### ISSUE TITLE
H02 protocol command issue 

### ISSUE THREAD

**Issue by pawelbury** [traccar/traccar#5110]
The H02 device does not recognise a command sent in a single packet with an ACK response. The error occurs when the device comes back online and the server sends both the ACK and the previously queued command at the same time. If only the command is sent in the packet then the device correctly recognises and executes the command. The same problem occurs with the new automatic command triggering by events function, here too the command is sent together with the ACK response. Is it possible to force each protocol frame to be sent in a separate packet? Below are the logs and tcpdump of the combined frames.
Logs:
```
2023-06-09 12:06:02  INFO: [T7e3fe84d: h02 < 94.254.225.7] 2a48512c393137313938373930302c56312c3130303535392c562c353130352e303432332c4e2c30313730332e333234322c452c3030302e30302c3030302c3039303632332c46374646464246462c3236302c30362c333033392c333132393423
2023-06-09 12:06:04  INFO: [T7e3fe84d] id: 9171987900, command type: alarmArm sent
2023-06-09 12:06:04  INFO: [T7e3fe84d] id: 9171987900, time: 2023-06-09 12:05:59, lat: 51.08459, lon: 17.05870, course: 0.0, accuracy: 1043.0
2023-06-09 12:06:04  INFO: [T7e3fe84d: h02 > 94.254.225.7] 2a48512c393137313938373930302c56342c56312c323032333036303931303036303223
2023-06-09 12:06:04  INFO: [T7e3fe84d: h02 > 94.254.225.7] 2a48512c393137313938373930302c5343462c3132303630342c302c3023
```
TCP dump:
```
12:06:02.891321 IP user-94-254-225-7.play-internet.pl.46666 > Traccar-test.5013: Flags [P.], seq 1639786251:1639786348, ack 2389178857, win 13600, options [nop,nop,TS val 1323663 ecr 1749488259], length 97
        0x0000:  4500 0095 98bc 4000 7506 181e 5efe e107  E.....@.u...^...
        0x0010:  0a0a 0a79 b64a 1395 61bd 270b 8e67 f9e9  ...y.J..a.'..g..
        0x0020:  8018 3520 773b 0000 0101 080a 0014 328f  ..5.w;........2.
        0x0030:  6847 1283 2a48 512c 3931 3731 3938 3739  hG..*HQ,91719879
        0x0040:  3030 2c56 312c 3130 3035 3539 2c56 2c35  00,V1,100559,V,5
        0x0050:  3130 352e 3034 3233 2c4e 2c30 3137 3033  105.0423,N,01703
        0x0060:  2e33 3234 322c 452c 3030 302e 3030 2c30  .3242,E,000.00,0
        0x0070:  3030 2c30 3930 3632 332c 4637 4646 4642  00,090623,F7FFFB
        0x0080:  4646 2c32 3630 2c30 362c 3330 3339 2c33  FF,260,06,3039,3
        0x0090:  3132 3934 23                             1294#
12:06:02.930582 IP Traccar-test.5013 > user-94-254-225-7.play-internet.pl.46666: Flags [.], ack 97, win 1042, options [nop,nop,TS val 1749542980 ecr 1323663], length 0
        0x0000:  4500 0034 0000 4000 4006 e63b 0a0a 0a79  E..4..@.@..;...y
        0x0010:  5efe e107 1395 b64a 8e67 f9e9 61bd 276c  ^......J.g..a.'l
        0x0020:  8010 0412 bf98 0000 0101 080a 6847 e844  ............hG.D
        0x0030:  0014 328f                                ..2.
12:06:04.578461 IP Traccar-test.5013 > user-94-254-225-7.play-internet.pl.46666: Flags [P.], seq 1:67, ack 97, win 1042, options [nop,nop,TS val 1749544627 ecr1323663], length 66
        0x0000:  4500 0076 0000 4000 4006 e5f9 0a0a 0a79  E..v..@.@......y
        0x0010:  5efe e107 1395 b64a 8e67 f9e9 61bd 276c  ^......J.g..a.'l
        0x0020:  8018 0412 b91a 0000 0101 080a 6847 eeb3  ............hG..
        0x0030:  0014 328f 2a48 512c 3931 3731 3938 3739  ..2.*HQ,91719879
        0x0040:  3030 2c56 342c 5631 2c32 3032 3330 3630  00,V4,V1,2023060
        0x0050:  3931 3030 3630 3223 2a48 512c 3931 3731  9100602#*HQ,9171
        0x0060:  3938 3739 3030 2c53 4346 2c31 3230 3630  987900,SCF,12060
        0x0070:  342c 302c 3023                           4,0,0#
12:06:05.425768 IP user-94-254-225-7.play-internet.pl.46666 > Traccar-test.5013: Flags [.], ack 67, win 13600, options [nop,nop,TS val 1324286 ecr 1749544627],length 0
        0x0000:  4500 0034 98bd 4000 7506 187e 5efe e107  E..4..@.u..~^...
        0x0010:  0a0a 0a79 b64a 1395 61bd 276c 8e67 fa2b  ...y.J..a.'l.g.+
        0x0020:  8010 3520 856a 0000 0101 080a 0014 34fe  ..5..j........4.
        0x0030:  6847 eeb3                                hG..
```

**Comment by tananaev** [comment]
I don't think it's possible to force it. That's just how TCP works. There are probably ways around it, like adding a delay.

**Comment by pawelbury** [comment]
Hi Anton,
I did a short test by adding a `flush` command at the end of the `write` function in the `StandardLoggingHandler` class:
``` java
...
@Override
    public void write(ChannelHandlerContext ctx, Object msg, ChannelPromise promise) throws Exception {
        log(ctx, true, msg);
        super.write(ctx, msg, promise);
        super.flush(ctx);
    }
...
```
This resulted in sending each command in a separate packet and then the device recognizes each command without a problem.
Unfortunately, I don't do any java programming and I don't handle TCP IP communications, so most likely my solution is not standards compliant.
Can we ask for a modification to flush the TCP buffer after each command at the appropriate place in the code?
